{
  "revision": "0.1.0",
  "taxonomyRevision": "0.1.0",
  "releaseStatus": "requires-human-verification",
  "frameworks": [
    {
      "id": "istqb",
      "title": "ISTQB Certified Tester Foundation Level",
      "edition": "4.0.1 (2024-09-15)",
      "url": "https://istqb.org/wp-content/uploads/2024/11/ISTQB_CTFL_Syllabus_v4.0.1.pdf",
      "accessedOn": "2026-09-11"
    },
    {
      "id": "wcag22",
      "title": "Web Content Accessibility Guidelines",
      "edition": "2.2 Recommendation 2024-12-12",
      "url": "https://www.w3.org/TR/2024/REC-WCAG22-20241212/",
      "accessedOn": "2026-09-11"
    },
    {
      "id": "sre-slo",
      "title": "Google Site Reliability Engineering: Service Level Objectives",
      "edition": "2016, chapter 4",
      "url": "https://sre.google/sre-book/service-level-objectives/",
      "accessedOn": "2026-09-11"
    },
    {
      "id": "sre-monitor",
      "title": "Google Site Reliability Engineering: Monitoring Distributed Systems",
      "edition": "2016, chapter 6",
      "url": "https://sre.google/sre-book/monitoring-distributed-systems/",
      "accessedOn": "2026-09-11"
    },
    {
      "id": "sre-testing",
      "title": "Google Site Reliability Engineering: Testing for Reliability",
      "edition": "2016, chapter 17",
      "url": "https://sre.google/sre-book/testing-reliability/",
      "accessedOn": "2026-09-11"
    },
    {
      "id": "sre-simplicity",
      "title": "Google Site Reliability Engineering: Simplicity",
      "edition": "2016, chapter 9",
      "url": "https://sre.google/sre-book/simplicity/",
      "accessedOn": "2026-09-11"
    },
    {
      "id": "sre-release",
      "title": "Google Site Reliability Engineering: Release Engineering",
      "edition": "2016, chapter 8",
      "url": "https://sre.google/sre-book/release-engineering/",
      "accessedOn": "2026-09-11"
    },
    {
      "id": "nist-recovery",
      "title": "NIST Contingency Planning Guide for Federal Information Systems",
      "edition": "SP 800-34 Revision 1 (2010)",
      "url": "https://csrc.nist.gov/pubs/sp/800/34/r1/final",
      "accessedOn": "2026-09-11"
    },
    {
      "id": "asvs",
      "title": "OWASP Application Security Verification Standard",
      "edition": "5.0.0",
      "url": "https://github.com/OWASP/ASVS/tree/v5.0.0/5.0/en",
      "accessedOn": "2026-09-11"
    },
    {
      "id": "ssdf",
      "title": "NIST Secure Software Development Framework",
      "edition": "SP 800-218, SSDF 1.1 (2022)",
      "url": "https://doi.org/10.6028/NIST.SP.800-218",
      "accessedOn": "2026-09-11"
    },
    {
      "id": "nasa-safety",
      "title": "NASA Software Assurance and Software Safety Standard",
      "edition": "NASA-STD-8739.8B (2022)",
      "url": "https://sma.nasa.gov/docs/default-source/policies/nasa-std-8739-8b.pdf",
      "accessedOn": "2026-09-11"
    },
    {
      "id": "cfr11",
      "title": "Controls for closed systems",
      "edition": "21 CFR 11.10, eCFR snapshot accessed 2026-09-11",
      "url": "https://www.ecfr.gov/current/title-21/chapter-I/subchapter-A/part-11/subpart-B/section-11.10",
      "accessedOn": "2026-09-11"
    },
    {
      "id": "hipaa",
      "title": "Technical safeguards",
      "edition": "45 CFR 164.312, eCFR snapshot accessed 2026-09-11",
      "url": "https://www.ecfr.gov/current/title-45/subtitle-A/subchapter-C/part-164/subpart-C/section-164.312",
      "accessedOn": "2026-09-11"
    },
    {
      "id": "pci",
      "title": "PCI SSC FAQ 1154: account-data retention",
      "edition": "PCI DSS requirement 3.3.1, FAQ accessed 2026-09-11",
      "url": "https://www.pcisecuritystandards.org/faqs/1154/",
      "accessedOn": "2026-09-11"
    },
    {
      "id": "section508",
      "title": "Revised 508 Standards and 255 Guidelines",
      "edition": "2017 rule, E205.4; accessed 2026-09-11",
      "url": "https://www.access-board.gov/ict/",
      "accessedOn": "2026-09-11"
    },
    {
      "id": "wcag20",
      "title": "Web Content Accessibility Guidelines",
      "edition": "2.0 Recommendation 2008-12-11",
      "url": "https://www.w3.org/TR/2008/REC-WCAG20-20081211/",
      "accessedOn": "2026-09-11"
    }
  ],
  "patterns": [
    {
      "id": "core.functional-completeness",
      "subCharacteristic": "functional-completeness",
      "characteristic": "functional-suitability",
      "template": "{{system}} shall provide implemented functions for at least {{target}} percent of the required tasks in {{scope}} under {{conditions}}.",
      "parameters": {
        "system": {
          "type": "string",
          "description": "System or component under assessment."
        },
        "scope": {
          "type": "string",
          "description": "Named, versioned task, interface, event or scenario inventory; must be nonempty."
        },
        "conditions": {
          "type": "string",
          "description": "Approved measurement plan: environment, workload/cohort, observation window, oracle, aggregation and exclusions."
        },
        "target": {
          "type": "number",
          "description": "Stakeholder-approved acceptance bound; no framework-prescribed default is implied.",
          "minimum": 0,
          "maximum": 100
        }
      },
      "metric": {
        "type": "coverage",
        "unit": "percent",
        "operator": ">=",
        "targetParameter": "target",
        "measurement": "Count tasks with an implemented function divided by all required tasks; freeze the task inventory before assessment."
      },
      "provenance": {
        "standardEdition": "ISO/IEC 25010:2023",
        "subCharacteristic": "functional-completeness",
        "frameworks": [
          {
            "id": "istqb",
            "section": "5.3.1 Metrics Used in Testing"
          }
        ],
        "derivation": "curator-authored; framework-informed measurement, not a normative ISO mapping"
      },
      "reviewStatus": "requires-human-verification"
    },
    {
      "id": "core.functional-correctness",
      "subCharacteristic": "functional-correctness",
      "characteristic": "functional-suitability",
      "template": "{{system}} shall produce the expected result in at least {{target}} percent of the oracle-backed cases in {{scope}} under {{conditions}}.",
      "parameters": {
        "system": {
          "type": "string",
          "description": "System or component under assessment."
        },
        "scope": {
          "type": "string",
          "description": "Named, versioned task, interface, event or scenario inventory; must be nonempty."
        },
        "conditions": {
          "type": "string",
          "description": "Approved measurement plan: environment, workload/cohort, observation window, oracle, aggregation and exclusions."
        },
        "target": {
          "type": "number",
          "description": "Stakeholder-approved acceptance bound; no framework-prescribed default is implied.",
          "minimum": 0,
          "maximum": 100
        }
      },
      "metric": {
        "type": "success-rate",
        "unit": "percent",
        "operator": ">=",
        "targetParameter": "target",
        "measurement": "Compare actual results with independently approved expected results; denominator includes every executed case."
      },
      "provenance": {
        "standardEdition": "ISO/IEC 25010:2023",
        "subCharacteristic": "functional-correctness",
        "frameworks": [
          {
            "id": "istqb",
            "section": "5.3.1 Metrics Used in Testing"
          }
        ],
        "derivation": "curator-authored; framework-informed measurement, not a normative ISO mapping"
      },
      "reviewStatus": "requires-human-verification"
    },
    {
      "id": "core.functional-appropriateness",
      "subCharacteristic": "functional-appropriateness",
      "characteristic": "functional-suitability",
      "template": "{{system}} shall enable completion of {{scope}} in at most {{target}} user actions per task under {{conditions}}.",
      "parameters": {
        "system": {
          "type": "string",
          "description": "System or component under assessment."
        },
        "scope": {
          "type": "string",
          "description": "Named, versioned task, interface, event or scenario inventory; must be nonempty."
        },
        "conditions": {
          "type": "string",
          "description": "Approved measurement plan: environment, workload/cohort, observation window, oracle, aggregation and exclusions."
        },
        "target": {
          "type": "number",
          "description": "Stakeholder-approved acceptance bound; no framework-prescribed default is implied.",
          "minimum": 0
        }
      },
      "metric": {
        "type": "count",
        "unit": "actions",
        "operator": "<=",
        "targetParameter": "target",
        "measurement": "Count actions from task start to successful goal; report the maximum across the predefined task set."
      },
      "provenance": {
        "standardEdition": "ISO/IEC 25010:2023",
        "subCharacteristic": "functional-appropriateness",
        "frameworks": [
          {
            "id": "istqb",
            "section": "2.2.2 Test Types; non-functional testing"
          }
        ],
        "derivation": "curator-authored; framework-informed measurement, not a normative ISO mapping"
      },
      "reviewStatus": "requires-human-verification"
    },
    {
      "id": "core.time-behaviour",
      "subCharacteristic": "time-behaviour",
      "characteristic": "performance-efficiency",
      "template": "{{system}} shall complete {{scope}} with a measured response-time percentile of at most {{target}} milliseconds under {{conditions}}.",
      "parameters": {
        "system": {
          "type": "string",
          "description": "System or component under assessment."
        },
        "scope": {
          "type": "string",